{
  "packageName": "com.bartovCoder.tripper",
  "displayName": {
    "he": "מאחורי ההר - Beyond the hill",
    "en": "מאחורי ההר - Beyond the hill"
  },
  "category": "NAVIGATION",
  "minimumVersionCode": 77,
  "sha256": "227299c5f9bd8731b4e9c7fa5353f2e9fc038c085aa6060f417e1db77f7c9d5f",
  "availableInStore": true,
  "grantsNetworkAccess": false,
  "minUserMode": "MOST_OPEN",
  "screenshots": [
    "https://play-lh.googleusercontent.com/LZvLaxA_u6yFMmRofl3aZftQpRscLKp5x0QbHb9hfT3rcu9DaDHurh17W6r2utDREpFBuN0VOEkbNjOsKHfDflQ",
    "https://play-lh.googleusercontent.com/FItKK5d455jacGbmVYbgvTh42I2rx_RdiLS4qiRnnuc5nOldd38WWtDiRkjCk3GbkA5KKv2LLRDqK_c8tbN-S64",
    "https://play-lh.googleusercontent.com/x5abXl3krqiNvyLxOxkU0_6JNmWH1DhCSq2C6RMaP4xql6DO1rfpl2VsRaue8AMmTUnQfcU7trJkPOlDzSXWa00",
    "https://play-lh.googleusercontent.com/iOZdjEDCHVorCMr8oobfx0qbR186BAm3Ouqa3O4XqnOypd6kC1k62_64ljILBp3C-s_purvvFN3UW5DObZrU"
  ],
  "source": {
    "type": "PLAY",
    "id": "com.bartovCoder.tripper"
  }
}
