{
  "packageName": "com.abaye.derechkohanim",
  "displayName": {
    "he": "דרך כהנים",
    "en": "Derech Kohanim"
  },
  "category": "TORAH",
  "minimumVersionCode": 1,
  "sha256": "1576ff26779c0f0e929b7da663f998183e4d6d3c3b78a42efe5dc91fc99f41ee",
  "availableInStore": false,
  "grantsNetworkAccess": true,
  "minUserMode": "NAVIGATION_ONLY",
  "flags": {
    "isRecommendedInStore": false
  },
  "notes": "Not published on Play, so it is not offered for installation and is installed by hand. The entry exists because network access is decided here: a package that is not in the catalog gets nothing, whatever its policy says. Pinned to the release signing certificate (C=IL, O=abaye, CN=abaye); a debug build carries a different certificate and will not be granted network."
}
