{
  "packageName": "com.gettaxi.android",
  "displayName": {
    "he": "גט",
    "en": "Gett"
  },
  "category": "NAVIGATION",
  "minimumVersionCode": 1026069,
  "sha256": "ea4dfeea9235b0130deecfc550dd3712c5b04fa724bcdede8916bca0574a2b2f",
  "availableInStore": true,
  "grantsNetworkAccess": true,
  "minUserMode": "NAVIGATION_ONLY",
  "flags": {
    "isRecommendedInStore": false
  },
  "source": {
    "type": "APKPURE",
    "id": "com.gettaxi.android"
  }
}
