{
  "packageName": "com.khl.kiosk",
  "displayName": {
    "he": "הקיוסק של קול הלשון",
    "en": "Kol Halashon Kiosk"
  },
  "category": "TORAH",
  "minimumVersionCode": 267,
  "sha256": "5b32d78ade54ca6e75c5681755778fed96e412e8ea0c4119d1c0c80642f0b530",
  "availableInStore": true,
  "grantsNetworkAccess": true,
  "minUserMode": "REDUCED_RISK",
  "source": {
    "type": "PLAY",
    "id": "com.khl.kiosk"
  },
  "notes": "Kol Halashon's older native player (2.67, versionCode 267, from Play), signed by Kol Halashon, the same key as com.khl.www2. A native player, unlike the WebView of com.khl.www2; see the policy notes.",
  "screenshots": [
    "https://play-lh.googleusercontent.com/AYKdO_TzzbEdvjzlTO5s7H8WxkGI7JCY8g9qY4f2r0RMSzS6OGSjU7NvycmuokAFPL-n5I8L_38dWvVYSZVqDA",
    "https://play-lh.googleusercontent.com/_GcnqqgH3kpfqeo_5FK9w3HqJoTwj8-C0-fVQGqPimSx5hYKEbtiubQO1Rr4IQ9B8DG0TLAbkI3ORKVaEz40",
    "https://play-lh.googleusercontent.com/CPn9IetKu1I4g1TjuffxNhuD_udrMXNlTyNoRwNLpH3ZoLqMXSFEHeQ8Iv5V6Cs2-DmJDjHhOQEAv7zDVGHDYw"
  ]
}
