{
  "packageName": "com.siddurim.klilat_yofi.sfard",
  "displayName": {
    "he": "סידור כלילת יופי - ספרד",
    "en": "Siddur Klilat Yofi - Sfard"
  },
  "category": "TORAH",
  "minimumVersionCode": 899,
  "sha256": "248d59718e0a6477c68bdea5ece85900f961ccc280941add75b4fb3ada279ec1",
  "availableInStore": true,
  "grantsNetworkAccess": true,
  "minUserMode": "NAVIGATION_ONLY",
  "flags": {
    "isRecommendedInStore": true
  },
  "source": {
    "type": "PLAY",
    "id": "com.siddurim.klilat_yofi.sfard"
  },
  "notes": "Siddur, nusach Sfard, from Siddurim.com. No ad SDK; Firebase for sync, remote config and Crashlytics. Pin and version from the build installed from Play (3.5.4, versionCode 899), signed with the developer's own key (O=Siddurim.com)."
}
