{
  "packageName": "co.bird.android",
  "displayName": {
    "he": "Bird - רכיבה חשמלית",
    "en": "Bird"
  },
  "category": "NAVIGATION",
  "minimumVersionCode": 908560,
  "sha256": "bd0bc056cb0183837e10d386d8c181b6444fc4174ed8badcd0d7295c204fcd91",
  "availableInStore": true,
  "grantsNetworkAccess": true,
  "minUserMode": "MOST_OPEN",
  "flags": {
    "hasUnmodestImage": true
  },
  "source": {
    "type": "PLAY",
    "id": "co.bird.android"
  },
  "notes": "Shared scooters. Flagged hasUnmodestImage: the sign in screen plays a video of people riding (res/raw/intro_video.mp4), packaged in the APK, so the tunnel cannot remove it. Braze, Stripe, Braintree and PayPal, Persona for identity checks, Zendesk. Pin and version from the build installed from Play (4.421.0.1, versionCode 908560), signed with the developer's own key (CN=Bird Ride, O=Bird Rides, L=Santa Monica, ST=CA, C=01). The flag keeps it out of REDUCED_RISK and asks for explicit acceptance; MOST_OPEN is stated so the entry says what the flag already means.",
  "screenshots": [
    "https://play-lh.googleusercontent.com/R0gIdTHSJezJppfAyFTpTKnInoItZwm1GXK7Zahcl9AMG_6Z-Eh3RoYav-RBlaNF1KSrVFiGYVVjgCCPBz4dudA",
    "https://play-lh.googleusercontent.com/3AmmMqJ8w81ffSybjpMjcL8-Y5Mvm1qPKtD2uLYcR00c9rkEV8jF84uTw1DIGF1I6uo2Vccizj93ZR_dSpiRoQ"
  ]
}
