{
  "packageName": "il.co.corido.cemeterynavigation",
  "displayName": {
    "he": "Gravez - ניווט בבתי עלמין",
    "en": "Gravez"
  },
  "category": "NAVIGATION",
  "minimumVersionCode": 104,
  "sha256": "a134cace06c37f225197e20d8cd206abd08b05aff0fb9bc612fb7328967b5804",
  "availableInStore": true,
  "grantsNetworkAccess": true,
  "minUserMode": "NAVIGATION_ONLY",
  "source": {
    "type": "PLAY",
    "id": "il.co.corido.cemeterynavigation"
  },
  "notes": "Finds a grave and walks you to it inside the cemetery. Pin and version from the build installed from Play (3.2.5, versionCode 104), signed with Play App Signing (CN=Android, O=Google Inc.). No advertising: none of the common ad SDKs are in the dex, the Google Ads classes present are the ones Firebase Analytics pulls in, and there is no AdMob application id. The 'AdvertisementService' class is Bluetooth LE advertising, not ads. sonol.co.il and trail-camera.co.il are website tags on points in the bundled OpenStreetMap extracts, and hagilda.com is a font's copyright line.",
  "screenshots": [
    "https://play-lh.googleusercontent.com/LOgWYA6lIAuwGqSJLDazovTl3OzrUubJURemYzHDyjjvR3BEsQ4vS89qoSqhmm0I0SDpKPVhwTXA_HYMEQ_E",
    "https://play-lh.googleusercontent.com/nvezu18naJnL3tZyLPOl4cl1tDaxuSuhKZFu2PWYQsvXXPycgEfB4XorP3LnQdBRzyFHPGskjx786CjqncrWzA",
    "https://play-lh.googleusercontent.com/tMge14ccdg43UpXdDKHvlPj511Spf35nIoBhA8rVf7ULFLsCzF7bYfJlabhryJc3PT7Wvf7IHyrWVSl3hUZH",
    "https://play-lh.googleusercontent.com/kiW4wpAGZbPrkZ_GW98qVdOQg2l1agkl5CfcyMJdC0q3XajmBgnAzNRj1FEE4s7TRrB87HyaLqfDnEZ7YPbr",
    "https://play-lh.googleusercontent.com/0pSbPhYDPpRvzpqeTev_c0fBt6zLq2XgXjRFVkrzGSiXUucDQDvPanXZNjzpS9CcT-FUt7dOmdpE8GXv2XtkWQ",
    "https://play-lh.googleusercontent.com/m-_TssdE3G7NQpnyFbIf2aMD-zWFDlNBUAqy7Jq0lhH4wIaqJVvQXD-hivcEN7lPF-B6Dl8vkUn6EmEWPmVclw",
    "https://play-lh.googleusercontent.com/ca_79eoTZs0FSFXxNLUgxfRBDL8IQvImkktzfNuktBtvfGxc0Roqfm-NVZND4sfRIlcoo5Id_bsZd6pNmAL0SiY"
  ]
}
